created_at,completed_at,task,tags
"2014-02-07 16:01:59 -0600","2014-02-07 16:25:18 -0600","Eat bananas before going to bed","personal,diet"
"2014-02-07 16:07:09 -0600","","Watch every episode of Seinfeld at least once","fun,personal"
"2014-02-07 16:07:05 -0600","","Teach my dog to make me banana smoothies","diet,personal"
"2014-02-07 16:07:06 -0600","","Memorize Ruby (all of it)","fun,work"
"2014-02-07 16:07:04 -0600","","Have torrid and educational affair with RSPEC expert","work,personal,fun"
"2014-02-07 17:29:24 -0600","","Call mom",""
"2014-02-07 18:24:18 -0600","2014-02-07 18:30:36 -0600","Be awesome!","personal"
